{"candidate_count":3,"candidates":[{"market_observation":{"high_price_24h":"1.0261","low_price_24h":"0.9905","mark_price":"1.0188","minimum_order_value":"5","range_24h_ratio":"0.03494307027875932469572045544","spread_bps":"0.9815469179426776599921476247","tick_size":"0.0001","turnover_24h":"279717554.4733"},"symbol":"XRPUSDT","validate_request":{"cell_number":2,"leverage":"1","max_price":"1.0364","min_price":"0.9805","stop_loss_price":"0.9706","take_profit_price":"1.0468"}},{"market_observation":{"high_price_24h":"0.07312","low_price_24h":"0.06984","mark_price":"0.07157","minimum_order_value":"5","range_24h_ratio":"0.0458292580690233337990778259","spread_bps":"1.397233477714126030459689814","tick_size":"0.00001","turnover_24h":"99250294.7926"},"symbol":"DOGEUSDT","validate_request":{"cell_number":2,"leverage":"1","max_price":"0.07386","min_price":"0.06914","stop_loss_price":"0.06844","take_profit_price":"0.0746"}},{"market_observation":{"high_price_24h":"8.822","low_price_24h":"8.435","mark_price":"8.764","minimum_order_value":"5","range_24h_ratio":"0.04415791875855773619351894112","spread_bps":"1.141031492469192149703331812","tick_size":"0.001","turnover_24h":"51688470.3797"},"symbol":"LINKUSDT","validate_request":{"cell_number":2,"leverage":"1","max_price":"8.911","min_price":"8.35","stop_loss_price":"8.266","take_profit_price":"9.001"}}],"evidence_schema":"grid.mainnet-validate-candidates/v1","filter":{"candidate_limit":3,"maximum_24h_range_ratio":"0.15","maximum_mark_price":"10","maximum_minimum_order_value":"5","maximum_spread_bps":"5","minimum_mark_price":"0.01","minimum_turnover_24h":"50000000","ranking":"minimum_order_value_asc,turnover_24h_desc,symbol_asc"},"observed_at_utc":"2026-08-12T08:15:56.795710Z","source":{"authentication":"none","instrument_endpoint":"/v5/market/instruments-info","ticker_endpoint":"/v5/market/tickers"},"status":"public-shortlist-only"}
